knesset,session,speaker,party,role,text,subject,sub_subject
,,תמר זנדברג,,השרה להגנת הסביבה,"תודה, אדוני היושב-ראש. חבר הכנסת יברקן, הרי אזרחי מדינת ישראל חיו כאן שנתיים וחצי או יותר בלי תקציב מדינה. ננצל את ההזדמנות שהגיע לכאן קהל רב לצאת רגע מהוויכוח הפוליטי, ורק להסביר משהו לאורחים שיושבים כאן.",2. ממשלה אכזרית כושלת כלכלית משבר דיור חסר תקדים – עלייה של 16% במחירי הדירות ועלייה של 40% במוצרי מזון,
,,דסטה גדי יברקן,הליכוד,,"הוא לא הספיק, זה לא נכון. הוא לא הספיק, זה לא נכון. עבר תקציב – – –",2. ממשלה אכזרית כושלת כלכלית משבר דיור חסר תקדים – עלייה של 16% במחירי הדירות ועלייה של 40% במוצרי מזון,
,,תמר זנדברג,,השרה להגנת הסביבה,"מאז שנכנסתי לתפקיד, אני מסתובבת – כמעט אין שבוע – –",2. ממשלה אכזרית כושלת כלכלית משבר דיור חסר תקדים – עלייה של 16% במחירי הדירות ועלייה של 40% במוצרי מזון,
,,דסטה גדי יברקן,הליכוד,,"היה תקציב, תודי בזה.",2. ממשלה אכזרית כושלת כלכלית משבר דיור חסר תקדים – עלייה של 16% במחירי הדירות ועלייה של 40% במוצרי מזון,
,,תמר זנדברג,,השרה להגנת הסביבה,"– – אין שבוע שאני לא נמצאת ברשות מקומית, מסתובבת המון. הבחירות לרשויות המקומיות היו בשנת 2018. אנחנו – יושבת כאן חברתי קארין אלהרר, אני בטוחה שגם אצלך זה ככה – השנה שנת 2021, את יושבת עם ראשי רשויות, והם אומרים לך: אני שלוש שנים ראש רשות ולא ראיתי תקציב מדינה. עזוב רגע ויכוח פוליטי, באמת אני אומרת – –",2. ממשלה אכזרית כושלת כלכלית משבר דיור חסר תקדים – עלייה של 16% במחירי הדירות ועלייה של 40% במוצרי מזון,
,,דסטה גדי יברקן,הליכוד,,אבל זה לא נכון. יש פרוטוקול – – –,2. ממשלה אכזרית כושלת כלכלית משבר דיור חסר תקדים – עלייה של 16% במחירי הדירות ועלייה של 40% במוצרי מזון,
,,תמר זנדברג,,השרה להגנת הסביבה,"– – ימין, שמאל, קואליציה, אופוזיציה – קודם כול תפקוד תקין של מדינה – –",2. ממשלה אכזרית כושלת כלכלית משבר דיור חסר תקדים – עלייה של 16% במחירי הדירות ועלייה של 40% במוצרי מזון,
,,דסטה גדי יברקן,הליכוד,,איזה תפקוד תקין?,2. ממשלה אכזרית כושלת כלכלית משבר דיור חסר תקדים – עלייה של 16% במחירי הדירות ועלייה של 40% במוצרי מזון,
,,תמר זנדברג,,השרה להגנת הסביבה,– – שהכסף עובר לרשויות המקומיות – –,2. ממשלה אכזרית כושלת כלכלית משבר דיור חסר תקדים – עלייה של 16% במחירי הדירות ועלייה של 40% במוצרי מזון,
,,דסטה גדי יברקן,הליכוד,,החברה שלך – – –,2. ממשלה אכזרית כושלת כלכלית משבר דיור חסר תקדים – עלייה של 16% במחירי הדירות ועלייה של 40% במוצרי מזון,
,,תמר זנדברג,,השרה להגנת הסביבה,"– – לפרויקטים המתוקצבים, לחוקים שכבר הוחלט עליהם. הרי זה בלתי מתקבל על הדעת לקלוע מדינה שלמה לסחרור ולשיתוק – למה? בגלל שראש הממשלה לא הצליח לנצח בבחירות – –",2. ממשלה אכזרית כושלת כלכלית משבר דיור חסר תקדים – עלייה של 16% במחירי הדירות ועלייה של 40% במוצרי מזון,
,,דסטה גדי יברקן,הליכוד,,נשמע לך הגיוני שמשחדים חברה שלך למפלגה ב-200 מיליון?,2. ממשלה אכזרית כושלת כלכלית משבר דיור חסר תקדים – עלייה של 16% במחירי הדירות ועלייה של 40% במוצרי מזון,
,,תמר זנדברג,,השרה להגנת הסביבה,"– – ובמקום להחזיר את המנדט ולבטא את הרוב בכנסת, כמו שיש כאן עכשיו, הוא מחליט ללכת לעוד בחירות ועוד בחירות ועוד בחירות, ומפלגת הליכוד, מפלגה שלמה – שאני מאוד מאוד מכבדת את הדמוקרטיה המפלגתית במפלגת הליכוד, אני חייבת לומר את זה; אני באמת מכבדת את זה, אבל הדמוקרטיה המפלגתית פה השתתקה לחלוטין כאשר חברי כנסת – והינה, נמצא פה גם חבר הכנסת ניר ברקת וחברים אחרים. אמרתי קודם לחברת הכנסת גילה גמליאל ולחבר הכנסת יואב גלנט שבשבוע האחרון – אפרופו חוק ממדים ללימודים, שאנחנו עומדים עוד מעט להצביע עליו – אמרו: לא יעלה על הדעת, אנחנו נעדיף את טובת האזרחים על פני טובתו של היושב-ראש שלנו, כי הוא משרת את ענייניו האישיים וגורר מפלגה שלמה, ששוכחת את הדמוקרטיה שלה, שוכחת את הערכים שלה, שוכחת את הציבור, שבשבילו אנחנו כולנו מתפקדים – –",2. ממשלה אכזרית כושלת כלכלית משבר דיור חסר תקדים – עלייה של 16% במחירי הדירות ועלייה של 40% במוצרי מזון,
,,דסטה גדי יברקן,הליכוד,,"אבל זה בדיוק מה שעכשיו אתם עשיתם, לאשר לזועבי 200 מיליון שקל.",2. ממשלה אכזרית כושלת כלכלית משבר דיור חסר תקדים – עלייה של 16% במחירי הדירות ועלייה של 40% במוצרי מזון,
,,תמר זנדברג,,השרה להגנת הסביבה,"– – ומשרתת כל-כולה אך ורק את המנהיג. זה דבר לא הגיוני. זה מאפיין לא של דמוקרטיות וגם לא של מפלגות דמוקרטיות – זה מאפיין של משטרים אחרים לחלוטין, ואלה בדיוק הרגעים שאני אומרת לעצמי איזה מזל שהקמנו ממשלה אחרת, שעובדת כאן, ברוך השם, כבר עוד מעט שנה, שעושה לטובת הציבור. הינה, נכנס לפה השר יועז הנדל, שהייתה לנו שיחת טלפון די סוערת בשבוע שעבר, נגלה לציבור. נגלה לציבור. הוא כנראה שייך לצד ימין של הממשלה, אני שייכת לצד שמאל של הממשלה. כנראה שיש בנינו הרבה חוסר הסכמות, אבל דבר אחד אני יכולה להסכים איתו, וזה ששנינו עובדים במשרדים שלנו לטובת הציבור ולטובת עניין. השר יועז הנדל עובד על פריסת סיבים, זה כבר נהיה הדגל שלו. בכל מקום שמדברים על יועז הנדל, אומרים סיבים; אומרים סיבים – אומרים יועז הנדל.אני רוצה לנצל את ההזדמנות, השר הנדל. למרות השיחה הקולנית הפרטית שהייתה לנו בשבוע שעבר, אתה עובד במשרד שלך ובכל השליחות הציבורית שלך לטובת הציבור כמו שאתה תופס אותו. אני יכולה לא להסכים איתך, ויש בינינו חילוקי דעות פוליטיים גם בתוך הממשלה, אבל שנינו עובדים, קמים בבוקר ועובדים ועושים.",2. ממשלה אכזרית כושלת כלכלית משבר דיור חסר תקדים – עלייה של 16% במחירי הדירות ועלייה של 40% במוצרי מזון,
,,יועז הנדל,,שר התקשורת,"תמר, תראי איזה יופי שנותנים לך להעביר זמן, זה מגיע למקומות – – –",2. ממשלה אכזרית כושלת כלכלית משבר דיור חסר תקדים – עלייה של 16% במחירי הדירות ועלייה של 40% במוצרי מזון,
,,תמר זנדברג,,השרה להגנת הסביבה,זה מגיע למחמאות אפילו לך.,2. ממשלה אכזרית כושלת כלכלית משבר דיור חסר תקדים – עלייה של 16% במחירי הדירות ועלייה של 40% במוצרי מזון,
,,יועז הנדל,,שר התקשורת,אני לא מאמין. תיתן לעוד שרים.,2. ממשלה אכזרית כושלת כלכלית משבר דיור חסר תקדים – עלייה של 16% במחירי הדירות ועלייה של 40% במוצרי מזון,
,,דסטה גדי יברקן,הליכוד,,"גברתי השרה, ביניכם אין כבר חילוקי דעות. כל דבר תעשי כמו הממשלה הזאת. הכול – – –",2. ממשלה אכזרית כושלת כלכלית משבר דיור חסר תקדים – עלייה של 16% במחירי הדירות ועלייה של 40% במוצרי מזון,
,,תמר זנדברג,,השרה להגנת הסביבה,"תאמין לי, יש בינינו הרבה מאוד חילוקי דעות, אבל אתה יודע מה? אבל אתה יודע מה? יש גם אווירה של ענייניות. בממשלה שאתם כיהנתם בה, גם אנשים מאוד מאוד קרובים אחד לשני מבחינה פוליטית כל היום היו רבים ומתקוטטים אחד עם השני – בגלל הפריימריז, בגלל דברים אחרים. תסתכל מסביב על האולם – – –",2. ממשלה אכזרית כושלת כלכלית משבר דיור חסר תקדים – עלייה של 16% במחירי הדירות ועלייה של 40% במוצרי מזון,
,,דסטה גדי יברקן,הליכוד,,בתור אחת שכמעט הפילה ממשלה כי יושב-ראש המפלגה לא אמר לה שלום.,2. ממשלה אכזרית כושלת כלכלית משבר דיור חסר תקדים – עלייה של 16% במחירי הדירות ועלייה של 40% במוצרי מזון,
,,תמר זנדברג,,השרה להגנת הסביבה,"חבר הכנסת יברקן, אנחנו בעיצומו של – או אחרי, מקווים שאחרי – משבר פוליטי, אבל גם משברים כאלה, מה שיפה, שאנחנו יודעים איך לצאת מהם ואיך לפתור אותם, בגלל שיש מטרה חשובה יותר שמרחפת כמטרייה וכגג מעל הראש של כולנו. ופה בשנים האחרונות הייתה תחושה שהאווירה הזאת קצת נשכחה, שהיה עדיף לריב אחד עם השני במקום לעבוד לטובת אזרחי המדינה; שהיה עדיף ללכת לעוד בחירות במקום לשאול את עצמנו אם זה מה שזקוקים לו אזרחי מדינת ישראל; שהיה עדיף לגרור מדינה ב-1 חלקי 12 ובקופסאות קורונה וכל מיני דברים כאלה במקום להעביר תקציב מדינה שיהיה בו סדר העדיפויות הלאומי והממשלתי.והתחושה הזאת – אני יכולה לספר לך שאיפה שאני לא הולכת ולאן שאני לא מגיעה אני שומעת אנשים שאומרים: לא הצבענו לך – ואומרים לי הרבה; אתה יודע, אני שייכת למפלגה של שישה מנדטים, הרבה מאוד בציבור לא הצביעו לי. גם אדוני היושב-ראש – אתם שישה או שבעה?",2. ממשלה אכזרית כושלת כלכלית משבר דיור חסר תקדים – עלייה של 16% במחירי הדירות ועלייה של 40% במוצרי מזון,
,,יבגני סובה,,"היו""ר",שבעה.,2. ממשלה אכזרית כושלת כלכלית משבר דיור חסר תקדים – עלייה של 16% במחירי הדירות ועלייה של 40% במוצרי מזון,
,,תמר זנדברג,,השרה להגנת הסביבה,"שבעה מנדטים. לא רחוקים בהרבה. אחת התגובות הכי הכי שכיחות שאני מקבלת – אנשים אומרים לי: לא הצבענו לך, הצבענו לצד השני, אבל בבקשה תמשיכו, כי אנחנו רוצים קצת שקט מכם. לא רוצים לשמוע כל הזמן בחירות וכל הזמן ריבים פוליטיים, רוצים שתלכו לעבוד, כל אחד במשרד שלו, כל אחד בתחום האחריות שלו. תעבדו למען אזרחי המדינה, ואל תבואו אלינו בכל ארבעה חודשים עם בחירות אחרי בחירות אחרי בחירות. זה דבר שאני קשובה לו מאוד. אני בטוחה שהרבה כאן מאזרחי המדינה – – –",2. ממשלה אכזרית כושלת כלכלית משבר דיור חסר תקדים – עלייה של 16% במחירי הדירות ועלייה של 40% במוצרי מזון,
,,דסטה גדי יברקן,הליכוד,,אני משוחרר? אני משוחרר?,2. ממשלה אכזרית כושלת כלכלית משבר דיור חסר תקדים – עלייה של 16% במחירי הדירות ועלייה של 40% במוצרי מזון,
,,תמר זנדברג,,השרה להגנת הסביבה,"הרבה מאוד מאזרחי המדינה, אני בטוחה שהם שומעים את התגובות האלה, וזו תגובה מאוד מאוד מאוד מאוד מאוד שכיחה. בגלל שהרבה אנשים הסתכלו עלינו בשנים האחרונות ואמרו: מה קורה להם שם? הרגישו שתחושת הניתוק בין מה שקורה בבית הזה, מה שאנשים פותחים בערוץ 99 ורואים, ובין החיים שלהם – – –",2. ממשלה אכזרית כושלת כלכלית משבר דיור חסר תקדים – עלייה של 16% במחירי הדירות ועלייה של 40% במוצרי מזון,
,,יבגני סובה,,"היו""ר","רק שנייה. חברים, חברי הכנסת עוד לא נכנסו לאולם, אבל יש רעש ענק, וזה רעש מהיציע. אני מבקש לשמור על השקט. כל מי שנמצא ביציע, נא לשמור על השקט, ותיתנו לשרה להמשיך לדבר.",2. ממשלה אכזרית כושלת כלכלית משבר דיור חסר תקדים – עלייה של 16% במחירי הדירות ועלייה של 40% במוצרי מזון,
,,אוריאל בוסו,"ש""ס",,"תמר זנדברג, לפי הסקרים – – –",2. ממשלה אכזרית כושלת כלכלית משבר דיור חסר תקדים – עלייה של 16% במחירי הדירות ועלייה של 40% במוצרי מזון,
,,יבגני סובה,,"היו""ר","בעוד כמה דקות אנחנו נעבור לדיון המיוחד עם הנשיאה של הפרלמנט האירופי, אבל בינתיים תכבדו את השרה, שעדיין נמצאת על דוכן הנאומים ונואמת. תודה.",2. ממשלה אכזרית כושלת כלכלית משבר דיור חסר תקדים – עלייה של 16% במחירי הדירות ועלייה של 40% במוצרי מזון,
,,תמר זנדברג,,השרה להגנת הסביבה,"תודה רבה, אדוני היושב-ראש. באמת הצטרדתי קצת, אבל זה רק מלהט הדברים. אני רוצה לברך את הציבור הרב והרחב שהגיע לכאן – חיילים, דיפלומטים, שוטרים, כל הציבור, תלמידים. מאיפה אתם? מאיפה אתם? מאיפה? אוניברסיטת תל אביב – אה, סטודנטים. שלום, ברוכים הבאים. ברוכים הבאים.",2. ממשלה אכזרית כושלת כלכלית משבר דיור חסר תקדים – עלייה של 16% במחירי הדירות ועלייה של 40% במוצרי מזון,
,,יעקב ליצמן,יהדות התורה,,זה נגד החוק.,2. ממשלה אכזרית כושלת כלכלית משבר דיור חסר תקדים – עלייה של 16% במחירי הדירות ועלייה של 40% במוצרי מזון,
,,תמר זנדברג,,השרה להגנת הסביבה,"למה? למה נגד החוק? נגד החוק? חבר הכנסת ליצמן, לשוחח עם הציבור בבית הפרלמנט, במשכנה של הדמוקרטיה הישראלית – נגד איזה חוק זה? אני חושבת שאתה קצת התבלבלת, חבר הכנסת ליצמן. אני מברכת בברכה את הציבור ואת הקהל. זה לא נגד שום חוק, אל תתבלבלו. אין חוק כזה.",2. ממשלה אכזרית כושלת כלכלית משבר דיור חסר תקדים – עלייה של 16% במחירי הדירות ועלייה של 40% במוצרי מזון,
,,דסטה גדי יברקן,הליכוד,,"גברתי השרה, חזרתי.",2. ממשלה אכזרית כושלת כלכלית משבר דיור חסר תקדים – עלייה של 16% במחירי הדירות ועלייה של 40% במוצרי מזון,
,,תמר זנדברג,,השרה להגנת הסביבה,"חסרת לי, התחלתי לדבר עם הקהל. ליצמן אומר לי שזה נגד החוק. בגלל שלא היה לי אותך.",2. ממשלה אכזרית כושלת כלכלית משבר דיור חסר תקדים – עלייה של 16% במחירי הדירות ועלייה של 40% במוצרי מזון,
,,דסטה גדי יברקן,הליכוד,,איפה היינו?,2. ממשלה אכזרית כושלת כלכלית משבר דיור חסר תקדים – עלייה של 16% במחירי הדירות ועלייה של 40% במוצרי מזון,
,,תמר זנדברג,,השרה להגנת הסביבה,"אני רוצה לקדם אתכם בברכה על הישיבה המיוחדת הזאת, שמסמנת את היחסים הטובים והחמים שלנו כמדינת ישראל עם מדינות אירופה, גם עם מדינות אחרות.הינה, הצטרף אלינו ראש הממשלה, שמכבד את הישיבה הזאת בנוכחותו. ובאמת, אני שמחה לברך אתכם כדי לראות איך נראה פרלמנט פעיל, שוקק, עובד, מחוקק. אשמח מאוד שכולכם תישארו פה גם בשעות הקרובות, כי בתום הישיבה הזאת יתחיל דיון על חוק מאוד מאוד חשוב, על מלגות לימודים לחיילי צה""ל, לחיילים משוחררים. אני חושבת שהצורך של כל חבר וחברת כנסת להסתכל לכם – – –",2. ממשלה אכזרית כושלת כלכלית משבר דיור חסר תקדים – עלייה של 16% במחירי הדירות ועלייה של 40% במוצרי מזון,
,,יבגני סובה,,"היו""ר","לא רק שיישארו – לאחר הדיון המיוחד, גם תמשיכי את הסיכום, ואז תהיה הצבעה. זה הסיכום, כן, אבל בינתיים יש עוד כמה דקות.",2. ממשלה אכזרית כושלת כלכלית משבר דיור חסר תקדים – עלייה של 16% במחירי הדירות ועלייה של 40% במוצרי מזון,
,,תמר זנדברג,,השרה להגנת הסביבה,"הבנתי. אז אחרי הדיון המיוחד אני אוכל לבוא לכאן ולבקש מכל הציבור הישראלי להסתכל לכל חבר וחברת כנסת בעיניים ולשאול אותם: איך אתם מצביעים על החוק החשוב הזה, על מלגת הלימודים הזו? האם אתם מעדיפים – – –",2. ממשלה אכזרית כושלת כלכלית משבר דיור חסר תקדים – עלייה של 16% במחירי הדירות ועלייה של 40% במוצרי מזון,
,,אוריאל בוסו,"ש""ס",,מה אכפת לכם מה האופוזיציה עושה? תעבירו. יש לכם בעיה להעביר?,2. ממשלה אכזרית כושלת כלכלית משבר דיור חסר תקדים – עלייה של 16% במחירי הדירות ועלייה של 40% במוצרי מזון,
,,תמר זנדברג,,השרה להגנת הסביבה,"אני קודם כול פניתי לציבור. אתה יודע, חבר הכנסת, בוא אגיד לך משהו. אתה יודע, אני חברת כנסת – הייתי בערך שמונה שנים באופוזיציה ועכשיו עוד שנה בממשלה. כשנכנסים לכאן, לבית הזה, לפעמים זה יכול קצת לבלבל. אפשר להתבלבל ולשכוח מי שלח אותך – ששלח אותנו בסוף, כל אחד מאיתנו, לא משנה אם קואליציה או אופוזיציה, שלח אותנו הציבור. והינה, יש לנו פה תזכורת, כי יושב פה ציבור של עשרות, אולי אפילו כמה מאות אנשים ביציע. אני מציעה לך להסתכל עליהם, אני מציעה לך להסתכל עליהם, כי להם, המילים קואליציה או אופוזיציה פחות משנות. יותר משנה להם השאלה אם החיילים המשוחררים – יש כאן סטודנטים מאוניברסיטת תל אביב, אני בטוחה שחלקם חיילים משוחררים – אם הם יוכלו ליהנות מהמלגה בשנת הלימודים הקרובה, כן או לא. אם הם יחזרו לקמפוס או יחזרו למשפחה שלהם ויגידו: חבר הכנסת אמר לי שהקואליציה תעביר, שהאופוזיציה תעביר – זה פחות משנה להם. יותר משנה להם מה הולך לקרות בחיים שלהם, וזה משהו שקצת קל לשכוח אותו כאן. זה משהו שכשנכנסים לבניין הזה, קצת קל לשכוח אותו וקל ליפול לאיזשהו בלבול.אבל אירועים כאלה, כשמגיע לכאן כלל הציבור והיציע מתמלא, הם בדיוק הזמנים עבורנו, נבחרי הציבור – וזה לא משנה אם אנחנו שרים או חברי כנסת, אם אנחנו בקואליציה, אם אנחנו באופוזיציה – זה הזמן שלנו להיזכר מי שלח אותנו ולמה. כי באמת, הרבה פעמים נופלים פה לאיזה משחק פוליטי. אומרים לנו: זה ככה, הקואליציה עשתה ככה, נפיל להם, נראה להם, נחזיר להם, נעשה להם. אבל באמת אני רוצה לבקש ממך באופן אישי להסתכל פה ליציע ולראות – הינה, לדוגמה, יושבות כאן חיילות מולנו.",2. ממשלה אכזרית כושלת כלכלית משבר דיור חסר תקדים – עלייה של 16% במחירי הדירות ועלייה של 40% במוצרי מזון,
,,יבגני סובה,,"היו""ר","תודה. גברתי השרה, אני נאלץ להפסיק את דברייך.",2. ממשלה אכזרית כושלת כלכלית משבר דיור חסר תקדים – עלייה של 16% במחירי הדירות ועלייה של 40% במוצרי מזון,
,,תמר זנדברג,,השרה להגנת הסביבה,חבל. אני דווקא הייתי – – –,2. ממשלה אכזרית כושלת כלכלית משבר דיור חסר תקדים – עלייה של 16% במחירי הדירות ועלייה של 40% במוצרי מזון,
,,יבגני סובה,,"היו""ר","כן, לאור הדיון המיוחד. אני שוב חוזר: אני מבקש שקט ביציע. אני נאלץ להפסיק את דברייך. אנחנו מייד נמשיך בהצעת האי-אמון ובסיכום, לאחר הדיון המיוחד בהשתתפות נשיאת הפרלמנט האירופי גב' רוברטה מטסולה.עכשיו אני מתכבד להעביר את הדיון ליושב-ראש הכנסת חבר הכנסת מיקי לוי.",ישיבה לכבוד נשיאת הפרלמנט האירופי גב' רוברטה מטסולה,
,,דן מרזוק,,מזכיר הכנסת,חברי הכנסת והקהל מתבקשים לכבד בקימה את כבוד נשיאת הפרלמנט האירופי וכבוד יושב-ראש הכנסת.(חברי הכנסת מכבדים בקימה את פני נשיאת הפרלמנט האירופי ויושב-ראש הכנסת.),ישיבה לכבוד נשיאת הפרלמנט האירופי גב' רוברטה מטסולה,
,,מיקי לוי,,"היו""ר",תודה רבה. בבקשה לשבת. אני מודה לכם.,ישיבה לכבוד נשיאת הפרלמנט האירופי גב' רוברטה מטסולה,
,,אחמד טיבי,הרשימה המשותפת,,– – –,ישיבה לכבוד נשיאת הפרלמנט האירופי גב' רוברטה מטסולה,
