knesset,session,speaker,party,role,text,subject,sub_subject
,,אלכס קושניר,,"יו""ר ועדת הכספים","אבל כאן, היום, להצביע נגד דבר כזה, שכל היום אני שומע מחברי הכנסת, גם מהליכוד וגם מהציונות הדתית: אנחנו בעד חיילי צה""ל, לחזק את חיילי צה""ל, צריך להגן על חיילי צה""ל. אבל בפועל, בשעת המבחן, אני מאוד מקווה שתוכלו להתעשת.המלגה הזאת לא עומדת בפני עצמה. היא באה כחלק ממהלך הרבה יותר גדול שמתחיל מהעלאת שכר החיילים ב-50%; שנמשך באותה תוכנית למיגון הצפון, שנתניהו כשהיה ראש הממשלה דאג לקבור אותה, אבל הצלחנו להוציא אותה מהקבר ואנחנו מקדמים אותה, זה נמשך באותה תוכנית מיגון אשקלון שהעברנו כאן בסך של 320 מיליון שקל, וכן, עכשיו גם עם מדים ללימודים. השלב הבא זה גם החיילים הבודדים, והשלב הבא זה להמשיך ולתגמל את המילואימניקים, והשלב הבא זה לדאוג לאלה שעובדים או להמשיך לדאוג לאלה שעובדים, משלמים מיסים, משרתים בצבא ועושים מילואים, ללא הבדל דת, גזע ומין.אבל אתם הופכים הכול לוויכוח סרק. כל מה שמעניין אתכם זה רק עוד קצת צעקות, ועוד קצת כותרות, ועוד קצת לייקים בפייסבוק על הסרטונים המגוחכים של חלק מכם. אני אומר לכם, חברים, יש דרך לצאת בכבוד מהאירוע הזה היום: פשוט תצביעו בעד. תצביעו בעד ותבטיחו, תהיה לכם עכשיו הזדמנות – עכשיו תעשו לנו פיליבסטר של כמה שעות, אז תהיה לכם הזדמנות לעלות כאן על בימת הכנסת ולהגיד את הדבר הפשוט הבא: אנחנו מתחייבים שבממשלה שאנחנו נקים אנחנו נביא את המלגה הזו ל-100%, אבל עכשיו, בשביל לא לפגוע בחיילים, אנחנו נעביר אותה ב-66%. ואז אתם יכולים לשפוך עלינו רפש כמה שאתם רוצים, לא אכפת לי, רק תצביעו בעד. כי זה לא בשבילי וזה לא בשביל חברי הקואליציה, זה לא בשביל שר האוצר וזה לא בשביל שר הביטחון, זה בשביל חיילי צה""ל, בשביל החבר'ה הצעירים, הלוחמים, שכל מה שמעניין אותם הוא שהיום המלגה הזו תעבור.ואגב, הדרישה הזו של 100% זה הדבר הכי מדהים. קודם כול, היא נולדה אתמול, פחות או יותר, אבל היא לא באה מהלוחמים, היא באה מכם. אתם יצרתם לכם איזושהי פנטזיה, עליתם על עץ מאוד מאוד מאוד גבוה ואתם פשוט לא מצליחים לרדת ממנו. אתם רוצים סולם? קחו לכם סולם. תבטיחו שברגע שתקימו את הממשלה תעלו את זה ל-100%, אבל בינתיים תעבירו את זה ב-66%. אני חושב שזה אחלה רעיון, במקום להפיל את זה עכשיו ולהשאיר את החיילים בלי כלום.עכשיו, תבינו את המשמעות: אם החוק לא עובר היום החיילים האלה לא יוכלו לקבל את המלגה לשנה הזאת. חלק מהם יצטרכו לעזוב את העבודה – סליחה, לעזוב את הלימודים, ללכת לעבוד. חלק מהם יצטרכו להיכנס לחובות, כי הם בנו על זה, הם בנו על המלגה הזו. אז אל תהרסו להם את החלומות. עכשיו, זה לא רק חיילים משוחררים לוחמים, זה גם הדור הצעיר שלנו. היום הם נמצאים במסלול של לקבל השכלה גבוהה, ובהחלטה הרדודה הזאת שאתם רוצים לקבל אתם פשוט תוציאו אותם מתוך מערכת הלימודים, אתם תהרסו להם את העתיד. בגלל שיקול פוליטי צר אתם תהרסו להם את העתיד. לא חבל? לא חבל?באמת, אני כבר לא יודע מה להגיד לכם. אתם פשוט חייבים להשאיר את הכול בצד, להצביע בעד ואחר כך נמשיך לריב, ולא חסר לנו על מה. נכון, אופיר? לא חסר לנו. כל יום בוועדת הכספים אנחנו רבים על משהו ומתווכחים על משהו וזה בסדר, ככה זה אמור להיות, אבל לא כשמדובר בחיילי צה""ל, חברים, לא כשמדובר בחיילים, באמת.","הצעת ועדת הכספים בדבר צו תעריף המכס והפטורים ומס קנייה על טובין (הוראת שעה מס' 13), התשפ""ב–2022",
,,אופיר כץ,הליכוד,,בחודש שעבר – – –,"הצעת ועדת הכספים בדבר צו תעריף המכס והפטורים ומס קנייה על טובין (הוראת שעה מס' 13), התשפ""ב–2022",
,,אלכס קושניר,,"יו""ר ועדת הכספים","אין בעיה, אופיר, תתחייב לתת להם 100% ברגע שאתה מקים ממשלה. אתה הרי תקים אותה מחר, אתה תקים אותה מחר, נכון? זה מה שאתם חושבים. אז יאללה, בבקשה, תעשו את זה, תעשו את זה. אבל היום אתם מוכנים לסכן את ה-66% ולהפיל את החוק. תבינו את האבסורד – –","הצעת ועדת הכספים בדבר צו תעריף המכס והפטורים ומס קנייה על טובין (הוראת שעה מס' 13), התשפ""ב–2022",
,,קטי קטרין שטרית,הליכוד,,"אלכס, אלכס.","הצעת ועדת הכספים בדבר צו תעריף המכס והפטורים ומס קנייה על טובין (הוראת שעה מס' 13), התשפ""ב–2022",
,,אלכס קושניר,,"יו""ר ועדת הכספים","– – של הטיעון ההגיוני שלכם. כן, קטי.","הצעת ועדת הכספים בדבר צו תעריף המכס והפטורים ומס קנייה על טובין (הוראת שעה מס' 13), התשפ""ב–2022",
,,קטי קטרין שטרית,הליכוד,,"תסתכל כמה אתם פראיירים: זועבי עשתה קצת שרירים – קיבלה 200, 200, 200, 200. תעשה – – –","הצעת ועדת הכספים בדבר צו תעריף המכס והפטורים ומס קנייה על טובין (הוראת שעה מס' 13), התשפ""ב–2022",
,,אלכס קושניר,,"יו""ר ועדת הכספים","אז בואי נדבר על זה, קטי. אני דיברתי על זה לפני שבאת.","הצעת ועדת הכספים בדבר צו תעריף המכס והפטורים ומס קנייה על טובין (הוראת שעה מס' 13), התשפ""ב–2022",
,,קטי קטרין שטרית,הליכוד,,"תעשה קצת שרירים, תקבל עוד 50, ההישג עליך. ההישג יהיה שלך. גם אתם, תקווה חדשה.","הצעת ועדת הכספים בדבר צו תעריף המכס והפטורים ומס קנייה על טובין (הוראת שעה מס' 13), התשפ""ב–2022",
,,אלכס קושניר,,"יו""ר ועדת הכספים","קטי, בואי אני אנפץ לך כמה סטיגמות.","הצעת ועדת הכספים בדבר צו תעריף המכס והפטורים ומס קנייה על טובין (הוראת שעה מס' 13), התשפ""ב–2022",
,,קטי קטרין שטרית,הליכוד,,"בשלוש שניות אתם משיגים את 50 המיליון וכולנו נצביע, למה לא.","הצעת ועדת הכספים בדבר צו תעריף המכס והפטורים ומס קנייה על טובין (הוראת שעה מס' 13), התשפ""ב–2022",
,,אלכס קושניר,,"יו""ר ועדת הכספים","בואי, אני אנפץ לך כמה סטיגמות. הסטיגמה הראשונה זה שיש פה מישהו שקיבל תוספת כסף. זה לא נכון. הסטיגמה השנייה – שהיום בוועדת כספים העברנו תוספת כספים לרשויות הערביות – – –","הצעת ועדת הכספים בדבר צו תעריף המכס והפטורים ומס קנייה על טובין (הוראת שעה מס' 13), התשפ""ב–2022",
,,קטי קטרין שטרית,הליכוד,,אז מה הבעיה – – –,"הצעת ועדת הכספים בדבר צו תעריף המכס והפטורים ומס קנייה על טובין (הוראת שעה מס' 13), התשפ""ב–2022",
,,אלכס קושניר,,"יו""ר ועדת הכספים","אז אני אומר לכם שגם זה לא נכון. למה? כי החלטה על זה התקבלה עוד בנובמבר, במהלך דיוני התקציב, על בסיס החלטות ממשלה. אז באמת, כאילו, אתם יכולים לשגע את הציבור ולהמשיך לשקר, ואני גם לא מצפה מכם להפסיק. תמשיכו. אתם חושבים שזו הדרך שלכם? בסוף הציבור ישפוט אתכם, לא אנחנו. אבל מדובר בחיילים, בלוחמים. לא תצביעו בעד? אתם יודעים מה, אל תצביעו בעד, תיעדרו מההצבעה, אל תהיו פה. זה מאוחר, 02:00, חלק מכם יהיו עייפים. אולי לא תהיו פה? אם מישהו רוצה טרמפ, תגידו – אני אעזור.","הצעת ועדת הכספים בדבר צו תעריף המכס והפטורים ומס קנייה על טובין (הוראת שעה מס' 13), התשפ""ב–2022",
,,אוריאל בוסו,"ש""ס",,"יש לכם שותפים, דבר איתם.","הצעת ועדת הכספים בדבר צו תעריף המכס והפטורים ומס קנייה על טובין (הוראת שעה מס' 13), התשפ""ב–2022",
,,אלכס קושניר,,"יו""ר ועדת הכספים","אנחנו נדאג לשותפים שלנו, אל תדאג, אבל אני, אוריאל, ממך, אתה יודע – אני רואה את ראש האופוזיציה משוחח בטלפון. אני מקווה מאוד שזה כדי להעביר לכם אחר כך הודעה שאתם מצביעים בעד. אני מאוד מקווה שאני לא אתבדה.","הצעת ועדת הכספים בדבר צו תעריף המכס והפטורים ומס קנייה על טובין (הוראת שעה מס' 13), התשפ""ב–2022",
,,משה אבוטבול,"ש""ס",,"אלכס, מה קרה, נגמרו לך המילים? נגמרו לך המילים?","הצעת ועדת הכספים בדבר צו תעריף המכס והפטורים ומס קנייה על טובין (הוראת שעה מס' 13), התשפ""ב–2022",
,,אלכס קושניר,,"יו""ר ועדת הכספים","משה אבוטבול, כשאני רואה אותך נגמרות לי המילים מייד.","הצעת ועדת הכספים בדבר צו תעריף המכס והפטורים ומס קנייה על טובין (הוראת שעה מס' 13), התשפ""ב–2022",
,,משה אבוטבול,"ש""ס",,את הכסף – – –,"הצעת ועדת הכספים בדבר צו תעריף המכס והפטורים ומס קנייה על טובין (הוראת שעה מס' 13), התשפ""ב–2022",
,,אלכס קושניר,,"יו""ר ועדת הכספים","באמת, אני רואה אותך – נגמרות לי המילים, כי כמות הרפש וגועל הנפש שאתה מוציא מהפה שלך באמת משתיקה הרבה מאוד אנשים.","הצעת ועדת הכספים בדבר צו תעריף המכס והפטורים ומס קנייה על טובין (הוראת שעה מס' 13), התשפ""ב–2022",
,,משה אבוטבול,"ש""ס",,אתה – – –,"הצעת ועדת הכספים בדבר צו תעריף המכס והפטורים ומס קנייה על טובין (הוראת שעה מס' 13), התשפ""ב–2022",
,,אלכס קושניר,,"יו""ר ועדת הכספים","המילים נגמרו לי, כן. אתה יודע למה נגמרו לי המילים? נגמרו לי המילים כי מסתכלים עלינו חבר'ה צעירים שאנחנו אמורים לתת להם איזושהי דוגמה והם פשוט מסתכלים ולא מבינים מה קורה בעולם ההזוי הזה, איך יכול להיות שיש פה 120 חברי כנסת ואין לנו רוב – –","הצעת ועדת הכספים בדבר צו תעריף המכס והפטורים ומס קנייה על טובין (הוראת שעה מס' 13), התשפ""ב–2022",
,,משה אבוטבול,"ש""ס",,"תמשוך, תמשוך עוד קצת, תמשוך.","הצעת ועדת הכספים בדבר צו תעריף המכס והפטורים ומס קנייה על טובין (הוראת שעה מס' 13), התשפ""ב–2022",
,,אלכס קושניר,,"יו""ר ועדת הכספים","– – בשביל להצביע ולהעביר את המלגה הזו. עכשיו, אנחנו – – –","הצעת ועדת הכספים בדבר צו תעריף המכס והפטורים ומס קנייה על טובין (הוראת שעה מס' 13), התשפ""ב–2022",
,,אוריאל בוסו,"ש""ס",,תגיד – – – איך יכול להיות – – –,"הצעת ועדת הכספים בדבר צו תעריף המכס והפטורים ומס קנייה על טובין (הוראת שעה מס' 13), התשפ""ב–2022",
,,אלכס קושניר,,"יו""ר ועדת הכספים",אנחנו נצביע.,"הצעת ועדת הכספים בדבר צו תעריף המכס והפטורים ומס קנייה על טובין (הוראת שעה מס' 13), התשפ""ב–2022",
,,קטי קטרין שטרית,הליכוד,,קושניר – – –,"הצעת ועדת הכספים בדבר צו תעריף המכס והפטורים ומס קנייה על טובין (הוראת שעה מס' 13), התשפ""ב–2022",
,,אלכס קושניר,,"יו""ר ועדת הכספים",אנחנו נצביע.,"הצעת ועדת הכספים בדבר צו תעריף המכס והפטורים ומס קנייה על טובין (הוראת שעה מס' 13), התשפ""ב–2022",
,,קטי קטרין שטרית,הליכוד,,"קושניר, אתם תהיו אלופים.","הצעת ועדת הכספים בדבר צו תעריף המכס והפטורים ומס קנייה על טובין (הוראת שעה מס' 13), התשפ""ב–2022",
,,אלכס קושניר,,"יו""ר ועדת הכספים","אבל אתה, אוריאל, תקום מחר בבוקר ותסתכל על עצמך במראה, ואני בטוח שלא יהיה לך פשוט, כי אני מכיר אותך. לא יהיה לך פשוט.","הצעת ועדת הכספים בדבר צו תעריף המכס והפטורים ומס קנייה על טובין (הוראת שעה מס' 13), התשפ""ב–2022",
,,משה אבוטבול,"ש""ס",,– – –,"הצעת ועדת הכספים בדבר צו תעריף המכס והפטורים ומס קנייה על טובין (הוראת שעה מס' 13), התשפ""ב–2022",
,,אלכס קושניר,,"יו""ר ועדת הכספים","וגם ליוסי לא יהיה פשוט, וגם לאבי דיכטר לא יהיה פשוט, וגם לישראל כץ לא יהיה פשוט.","הצעת ועדת הכספים בדבר צו תעריף המכס והפטורים ומס קנייה על טובין (הוראת שעה מס' 13), התשפ""ב–2022",
,,רון כץ,יש עתיד,,מה עם גלנט?,"הצעת ועדת הכספים בדבר צו תעריף המכס והפטורים ומס קנייה על טובין (הוראת שעה מס' 13), התשפ""ב–2022",
,,אלכס קושניר,,"יו""ר ועדת הכספים",ובטוח ליואב גלנט לא יהיה פשוט.,"הצעת ועדת הכספים בדבר צו תעריף המכס והפטורים ומס קנייה על טובין (הוראת שעה מס' 13), התשפ""ב–2022",
,,אוריאל בוסו,"ש""ס",,למה אתם מפלים את החיילים – – –,"הצעת ועדת הכספים בדבר צו תעריף המכס והפטורים ומס קנייה על טובין (הוראת שעה מס' 13), התשפ""ב–2022",
,,אלכס קושניר,,"יו""ר ועדת הכספים","אגב, בשבוע שעבר שמענו אותם, שמענו אותם מדברים נגד ההחלטה הזאת. אבל מה קרה עכשיו? אז חברים, אני מזכיר לכם רק שלושה ערכים מרוח צה""ל, שאתה, משה אבוטבול, לא מכיר, אבל רוב האנשים כן מכירים.","הצעת ועדת הכספים בדבר צו תעריף המכס והפטורים ומס קנייה על טובין (הוראת שעה מס' 13), התשפ""ב–2022",
,,משה אבוטבול,"ש""ס",,אלכס – – –,"הצעת ועדת הכספים בדבר צו תעריף המכס והפטורים ומס קנייה על טובין (הוראת שעה מס' 13), התשפ""ב–2022",
,,אלכס קושניר,,"יו""ר ועדת הכספים",אז אני אגיד לכם ככה – –,"הצעת ועדת הכספים בדבר צו תעריף המכס והפטורים ומס קנייה על טובין (הוראת שעה מס' 13), התשפ""ב–2022",
,,משה אבוטבול,"ש""ס",,"אלכס, אלכס, גם – – –","הצעת ועדת הכספים בדבר צו תעריף המכס והפטורים ומס קנייה על טובין (הוראת שעה מס' 13), התשפ""ב–2022",
,,אלכס קושניר,,"יו""ר ועדת הכספים","– – ערך האמינות, ערך הרעות – –","הצעת ועדת הכספים בדבר צו תעריף המכס והפטורים ומס קנייה על טובין (הוראת שעה מס' 13), התשפ""ב–2022",
,,משה אבוטבול,"ש""ס",,אלכס – – –,"הצעת ועדת הכספים בדבר צו תעריף המכס והפטורים ומס קנייה על טובין (הוראת שעה מס' 13), התשפ""ב–2022",
,,אלכס קושניר,,"יו""ר ועדת הכספים","– – ערך הדוגמה האישית. בהחלטה ההזויה שלכם להצביע נגד ממדים ללימודים אתם פשוט מפירים את שלושת הערכים האלה. ולך, משה אבוטבול, אני אעביר לך את המסמך כדי שתוכל לקרוא ולהבין על מה מושתתת הרעות של לוחמים בצה""ל, כי אתה לא מכיר את זה, זה עולם שמאוד זר לך. אבל – – –","הצעת ועדת הכספים בדבר צו תעריף המכס והפטורים ומס קנייה על טובין (הוראת שעה מס' 13), התשפ""ב–2022",
,,משה אבוטבול,"ש""ס",,"הייתי שם, חמודי, הייתי שם.","הצעת ועדת הכספים בדבר צו תעריף המכס והפטורים ומס קנייה על טובין (הוראת שעה מס' 13), התשפ""ב–2022",
,,אלכס קושניר,,"יו""ר ועדת הכספים","כן, אני יודע, אני יודע שהיית, אבל מאז עבר – –","הצעת ועדת הכספים בדבר צו תעריף המכס והפטורים ומס קנייה על טובין (הוראת שעה מס' 13), התשפ""ב–2022",
,,משה אבוטבול,"ש""ס",,"חמודי, תירגע, תירגע, הייתי שם.","הצעת ועדת הכספים בדבר צו תעריף המכס והפטורים ומס קנייה על טובין (הוראת שעה מס' 13), התשפ""ב–2022",
,,אלכס קושניר,,"יו""ר ועדת הכספים",– – הרבה מאוד זמן וזה כבר לא כזה קרוב אליך.,"הצעת ועדת הכספים בדבר צו תעריף המכס והפטורים ומס קנייה על טובין (הוראת שעה מס' 13), התשפ""ב–2022",
,,משה אבוטבול,"ש""ס",,"אבל בליבה, בליבה לימדו אותנו ש-100% זה יותר מ-60%.","הצעת ועדת הכספים בדבר צו תעריף המכס והפטורים ומס קנייה על טובין (הוראת שעה מס' 13), התשפ""ב–2022",
,,אלכס קושניר,,"יו""ר ועדת הכספים",ואיך אני יודע שאני צודק?,"הצעת ועדת הכספים בדבר צו תעריף המכס והפטורים ומס קנייה על טובין (הוראת שעה מס' 13), התשפ""ב–2022",
,,משה אבוטבול,"ש""ס",,100% זה יותר מ-60%.,"הצעת ועדת הכספים בדבר צו תעריף המכס והפטורים ומס קנייה על טובין (הוראת שעה מס' 13), התשפ""ב–2022",
,,אלכס קושניר,,"יו""ר ועדת הכספים",היום אתה הולך להצביע נגד.,"הצעת ועדת הכספים בדבר צו תעריף המכס והפטורים ומס קנייה על טובין (הוראת שעה מס' 13), התשפ""ב–2022",
,,משה אבוטבול,"ש""ס",,"את זה אותנו לימדו, ש-100% זה יותר מ-60%.","הצעת ועדת הכספים בדבר צו תעריף המכס והפטורים ומס קנייה על טובין (הוראת שעה מס' 13), התשפ""ב–2022",
,,אלכס קושניר,,"יו""ר ועדת הכספים","אני יודע עוד דבר, חבר הכנסת אבוטבול.","הצעת ועדת הכספים בדבר צו תעריף המכס והפטורים ומס קנייה על טובין (הוראת שעה מס' 13), התשפ""ב–2022",
,,משה אבוטבול,"ש""ס",,"אני יודע ש-100% זה יותר מ-60%, אז תלך, תלמד ליבה יחד עם – – –","הצעת ועדת הכספים בדבר צו תעריף המכס והפטורים ומס קנייה על טובין (הוראת שעה מס' 13), התשפ""ב–2022",
,,אלכס קושניר,,"יו""ר ועדת הכספים","אתם הטלתם וטו. אתם הטלתם וטו על הליכוד, על ההצבעה הזו.","הצעת ועדת הכספים בדבר צו תעריף המכס והפטורים ומס קנייה על טובין (הוראת שעה מס' 13), התשפ""ב–2022",
,,משה אבוטבול,"ש""ס",,תלמד ש-100% זה יותר מ-60%.,"הצעת ועדת הכספים בדבר צו תעריף המכס והפטורים ומס קנייה על טובין (הוראת שעה מס' 13), התשפ""ב–2022",
,,אלכס קושניר,,"יו""ר ועדת הכספים","אתם לא מתביישים? על חיילי צה""ל להטיל וטו?","הצעת ועדת הכספים בדבר צו תעריף המכס והפטורים ומס קנייה על טובין (הוראת שעה מס' 13), התשפ""ב–2022",
,,משה אבוטבול,"ש""ס",,"תלמד ליבה, 100% זה יותר מ-60%, לך תלמד – –","הצעת ועדת הכספים בדבר צו תעריף המכס והפטורים ומס קנייה על טובין (הוראת שעה מס' 13), התשפ""ב–2022",
,,אלכס קושניר,,"יו""ר ועדת הכספים",הווטו הזה זה אות קין על כולכם – –,"הצעת ועדת הכספים בדבר צו תעריף המכס והפטורים ומס קנייה על טובין (הוראת שעה מס' 13), התשפ""ב–2022",
,,משה אבוטבול,"ש""ס",,"– – ליבה, אתה וראש הממשלה שלך.","הצעת ועדת הכספים בדבר צו תעריף המכס והפטורים ומס קנייה על טובין (הוראת שעה מס' 13), התשפ""ב–2022",
,,אלכס קושניר,,"יו""ר ועדת הכספים","– – על כל מי שהולך להצביע נגד, על כל מי – –","הצעת ועדת הכספים בדבר צו תעריף המכס והפטורים ומס קנייה על טובין (הוראת שעה מס' 13), התשפ""ב–2022",
,,משה אבוטבול,"ש""ס",,לך תלמד ליבה.,"הצעת ועדת הכספים בדבר צו תעריף המכס והפטורים ומס קנייה על טובין (הוראת שעה מס' 13), התשפ""ב–2022",
,,אלכס קושניר,,"יו""ר ועדת הכספים",– – שהולך להצביע נגד. זה אות קין.,"הצעת ועדת הכספים בדבר צו תעריף המכס והפטורים ומס קנייה על טובין (הוראת שעה מס' 13), התשפ""ב–2022",
,,משה אבוטבול,"ש""ס",,"לך תלמד ליבה, צבוע – – –","הצעת ועדת הכספים בדבר צו תעריף המכס והפטורים ומס קנייה על טובין (הוראת שעה מס' 13), התשפ""ב–2022",
,,אלכס קושניר,,"יו""ר ועדת הכספים",בסוף אני בטוח שלכל אחד מכם יש חברים ויש משפחות – –,"הצעת ועדת הכספים בדבר צו תעריף המכס והפטורים ומס קנייה על טובין (הוראת שעה מס' 13), התשפ""ב–2022",
,,משה אבוטבול,"ש""ס",,100% יא שקרן.,"הצעת ועדת הכספים בדבר צו תעריף המכס והפטורים ומס קנייה על טובין (הוראת שעה מס' 13), התשפ""ב–2022",
,,אלכס קושניר,,"יו""ר ועדת הכספים",– – ויש שם חבר'ה שמשרתים בצבא.,"הצעת ועדת הכספים בדבר צו תעריף המכס והפטורים ומס קנייה על טובין (הוראת שעה מס' 13), התשפ""ב–2022",
,,משה אבוטבול,"ש""ס",,יש – – –,"הצעת ועדת הכספים בדבר צו תעריף המכס והפטורים ומס קנייה על טובין (הוראת שעה מס' 13), התשפ""ב–2022",
