knesset,session,speaker,party,role,text,subject,sub_subject
,,מיכל וולדיגר,הציונות הדתית,,"כבוד היושבת-ראש, כבוד השר, כנסת נכבדה, אז הצעת החוק, חוק יו""ש, נפלה. 52:58 – זוהי תמונת המצב של הממשלה הנוכחית; תמונת מצב של ממשלה וקואליציה שנשענות על מפלגות פוסט-ציוניות במקרה הטוב, ומפלגות שיש בין חבריהן כאלה התומכים בטרור ומחבקים מחבלים שדם יהודים על ידיהם במקרה הרע, ממשלה שאין לה זכות קיום.ההצבעה הנוכחית, שמטרתה צירוף שר לממשלה – אני רוצה להזכיר לכולכם את נאומו של יאיר לפיד, למיטב זיכרוני זה היה בהצעת האי-אמון שהוא העלה בממשלה הקודמת. יאיר לפיד, שצעק עד כמה מדובר בממשלה חזירית שמבזבזת את כספי הציבור במינוי אין-ספור של שרים, יאיר לפיד דיבר על כך שיש לצמצם את שרי הממשלה, והבטיח, ממש הבטיח, שבממשלה שהוא יקים או שהוא ייקח בה חלק יהיו 18 שרים בלבד. אבל יאיר לפיד, כמו גם שרים רבים בממשלה הנוכחית, יודע לדבר, פחות לעשות. מילים לחוד ומעשים לחוד. הממשלה שהוא משמש בה כראש הממשלה החלופי מונה 26 שרים ושבעה סגני שרים. הרבה הרבה מעבר לאותם 18 שרים שעליהם הוא התחייב. אז בשביל מה צריך עוד שר? מיותר לחלוטין. אז בהמשך לכל מה שנאמר פה קודם על ידי חבריי, גם מן הטעם הזה, שאין עוד צורך להגדיל את הממשלה בעוד שר, אנחנו נצביע נגד המינוי הזה.בזמן הקצר שנשאר לי, חשוב לי לקרוא מפה לשר הבריאות ולמנכ""ל משרד הבריאות פרופ' נחמן אש לפתור לאלתר את הבעיה שקיימת זה חודשים במכון האונקולוגי בבית החולים וולפסון בחולון. כבר חודשים מקבלים מנהלת בית החולים ומנכ""ל המשרד התראות על כך שמיטות האשפוז לחולי סרטן שנלקחו בחסות הקורונה לא הוחזרו, ולכן חולי הסרטן ממשיכים לקבל כימותרפיה במסדרון, ממש במסדרון של המחלקה הפנימית. למרבה הצער, עד עכשיו לא נעשה דבר להסדיר את הבעיה, והתוצאה היא המשך קבלת טיפול באופן שמסכן את חולי הסרטן ואת שאר המאושפזים והצוות במחלקה הפנימית. המכון האונקולוגי בוולפסון בקריסה, לפחות על פי רן רזניק מישראל היום. לא מדובר רק במחסור של מיטות, אלא גם במחסור של כוח אדם ובתחזוקה גרועה ביותר. מבקר הפנים של בית החולים פנה למנכ""ל משרד הבריאות ודרש את התערבות המשרד באופן דחוף, ולצערי עד לרגעים אלו המשבר בין הנהלת בית החולים לבין המכון לא טופל. הנפגעים כאמור אלו החולים והצוות, ואסור להניח לזה.",הודעת הממשלה על צירוף שר לממשלה ועל שינוי בחלוקת התפקידים בין השרים,
,,ג'ידא רינאוי זועבי,,"היו""ר","תודה רבה. חבר הכנסת יואב קיש – הרגע ראיתי אותו. חבר הכנסת יואב קיש, אתה רשום, בבקשה.",הודעת הממשלה על צירוף שר לממשלה ועל שינוי בחלוקת התפקידים בין השרים,
,,אופיר אקוניס,הליכוד,,אני אחליף אותו.,הודעת הממשלה על צירוף שר לממשלה ועל שינוי בחלוקת התפקידים בין השרים,
,,ג'ידא רינאוי זועבי,,"היו""ר","אוקיי. בבקשה, חבר הכנסת, אתה רשום גם. בסדר, אין בעיה. אז חבר הכנסת אופיר אקוניס, בבקשה.",הודעת הממשלה על צירוף שר לממשלה ועל שינוי בחלוקת התפקידים בין השרים,
,,אופיר אקוניס,הליכוד,,"תודה רבה, היושבת-ראש. חברות וחברי הכנסת, הערב הזה אנחנו למדים שלקואליציה הזאת אין שום גבול. אין לה גבול. ממשלה שהתפרקה הערב, התפרקה אל מול עינינו – אגב, את אחת המפרקות, ועל כך אני שמח – מביאה לדיון ביום שהיא מתפרקת מינוי של שר נוסף, מיותר לגמרי, בניגוד לכל ההבטחות של ראש הממשלה יאיר לפיד, על חשבון הציבור, אלא מה. אם מישהו מוציא שם רע – – –",הודעת הממשלה על צירוף שר לממשלה ועל שינוי בחלוקת התפקידים בין השרים,
,,חיים כץ,הליכוד,,בגלל שהוא ידע שהוא מיותר הוא התפטר.,הודעת הממשלה על צירוף שר לממשלה ועל שינוי בחלוקת התפקידים בין השרים,
,,אופיר אקוניס,הליכוד,,"כן, הוא התפטר, נכון, לפני שלושה שבועות.",הודעת הממשלה על צירוף שר לממשלה ועל שינוי בחלוקת התפקידים בין השרים,
,,חיים כץ,הליכוד,,"הוא ידע שהוא מיותר, ועשה משהו נכון והתפטר. בשביל מה הוא בא עוד פעם?",הודעת הממשלה על צירוף שר לממשלה ועל שינוי בחלוקת התפקידים בין השרים,
,,אופיר אקוניס,הליכוד,,"לפני שלושה שבועות או ארבעה שבועות הוא התפטר כדי לסלק מכאן את ג'וב טוב כלפון, שהיה בעצמו ג'וב טוב או ג'וב רע או השד יודע מה. ואתם פשוט מוציאים, חבר הכנסת כץ, שם רע לפוליטיקה הישראלית. המיצובישי של גולדפרב כבר מחווירה, החווירה, לעומת מה שמתחולל כאן הערב הזה. ועוד מפיצים תמונה מזויפת, מלאכותית, מעוררת חמלה, באמת מעוררת רחמים, של השר המיועד כהנא הולך לישון בזמן שאנחנו כאן על הדוכן בדיון על המינוי המיותר שלו.הממשלה הזאת סיימה את דרכה. כל העם ראה את זה הערב בשידור חי, חוץ מחברי הממשלה. ועכשיו, בשם הסחטנות, בשם השחיתות הציבורית – אגב, אני שואל את עצמי: איפה הם כל אותם ארגונים, גברתי היושבת-ראש, שמיהרו, אצו רצו לבג""ץ, אצו רצו למבקר המדינה, אצו רצו לכל רשויות החוק על כל מינוי של משרת אמון בלשכות השרים הקודמים? נעלמו, לא קיימים. מה קרה? המימון מאירופה הסתיים? יש מיתון באירופה אז הם לא נותנים להם כסף? זה דבר מדהים.ובשם הפצת השנאה והרעל מנסים למנות עוד שר, ומה יזכרו מן הממשלה הרעה הזאת, המושחתת הנסחטת? אדמה חרוכה, דמוקרטיה מרוסקת. איפה הדגלים השחורים? בכל מוצאי שבת הדגלים הונפו אל על. איפה הם נעלמו עם הממשלה המושחתת ביותר בתולדות המדינה? שחיתות שלא נראתה. גם הם, יחד עם הארגונים האלה, פתאום נעלמו להם. וכמובן, אטימות מוחלטת לכספו של הציבור. זוהי הממשלה הזאת – נסחטת, מושחתת אטומה.אמרו פעם, את יודעת, גברתי היושבת-ראש, את המושג הזה ""מושחתים הביתה"". אני אומר לכם: אתם כבר הולכים הביתה, היום ראו את זה, כולם ראו את זה. אז תלכו כבר.",הודעת הממשלה על צירוף שר לממשלה ועל שינוי בחלוקת התפקידים בין השרים,
,,ג'ידא רינאוי זועבי,,"היו""ר","תודה רבה. חבר הכנסת בצלאל סמוטריץ', ומייד אחרי זה – חבר הכנסת יואב קיש.",הודעת הממשלה על צירוף שר לממשלה ועל שינוי בחלוקת התפקידים בין השרים,
,,בצלאל סמוטריץ',הציונות הדתית,,"גברתי היושבת-ראש, חברי השר, חבריי חברי הכנסת, כשאלקין עמד כאן קודם על הדוכן ונאם, חשבתי שצריך להביא מציל, כמו בחוף הים, מכיוון שהצביעות שנטפה לו מהאוזניים איימה להטביע את כל יושבי האולם הנכבד הזה.",הודעת הממשלה על צירוף שר לממשלה ועל שינוי בחלוקת התפקידים בין השרים,
,,חיים כץ,הליכוד,,"למה לא אמרת, הייתי מביא מצופים.",הודעת הממשלה על צירוף שר לממשלה ועל שינוי בחלוקת התפקידים בין השרים,
,,בצלאל סמוטריץ',הציונות הדתית,,"עומד בן אדם שמכר את כל ערכיו לתומכי טרור אנטי-ציונים ולשמאל הקיצוני רק בגלל שנתניהו פגע בו ומינה אותו לשר המים, ומטיף לנו מוסר שאנחנו בוגדים בערכים שלנו ומצביעים נגד ההתיישבות. אז תשמע, אלקין, בשונה ממך אני לא מכרתי את ערכיי. אני לא צריך להוכיח לאף אחד את המחויבות ואת הנאמנות שלי למפעל ההתיישבות ביהודה ושומרון. אני חי בו מגיל אפס, אני עובד בו, אני מגויס אליו – לא רק אליו, לעוד הרבה דברים חשובים. אגב, בדיוק כפי שלא הייתי צריך להוכיח את נאמנותי לחיילי צה""ל בחוק ממדים ללימודים.אבל אתה? אתה שהפנית עורף למחנה הלאומי ולציונות ולהתיישבות ולבסיס היהודי של המדינה הזאת וחברת לכל מי שקורא למתיישבים תתי-אדם, חברת לאנשים שלא מסוגלים להצביע בעד ההתיישבות – אתה יודע מה, לאנשים שתומכים במי שרוצח את המתיישבים ואת חיילי צה""ל, אליהם חברת. חברת לכל מי שנלחם בכל מה שריח יהדות מריח ממנו שנים; כל מי שמזוהה עם המאבקים נגד המדינה הזאת כמדינה יהודית. אליהם חברת בגלל שנאת נתניהו? בגלל כל מיני יריבויות ומשקעים אישיים? אתה תטיף לנו מוסר על דאגה להתיישבות? זו כבר אפילו לא האירוניה התאבדה. אין מילה בעברית שיכולה לבטא את האבסורד ואת הצביעות שבנאום שנתת כאן.אנחנו תומכים בהתיישבות ומחויבים להתיישבות. ואנחנו בעזרת השם נמשיך לפתח אותה, להגדיל אותה, לבנות אותה – מה שחבריך, ברובם הגדול, בקואליציה הזאת, מתנגדים לו. אין אף אחד שקונה את זה שאנחנו כביכול נגד ההתיישבות ושהחברים שלך, רע""מ ווליד טאהא, וכן, עיסאווי פריג' ואחרים, הם בעד ההתיישבות. חפש לעצמך טיעונים קצת יותר אינטליגנטיים, אלקין. תראה מה נהיה ממך.אנחנו הצבענו נגד ממשלת מיעוט שנשענת על תומכי טרור לא ציוניים ומשעבדת את קבלת ההחלטות במדינת ישראל אליהם. כן, הצבענו נגד ממשלה שמחכה למוצא פיה של מועצת השורא לפני כל החלטה דרמטית.",הודעת הממשלה על צירוף שר לממשלה ועל שינוי בחלוקת התפקידים בין השרים,
,,ג'ידא רינאוי זועבי,,"היו""ר",תודה רבה.,הודעת הממשלה על צירוף שר לממשלה ועל שינוי בחלוקת התפקידים בין השרים,
,,בצלאל סמוטריץ',הציונות הדתית,,"הצבענו בעד ההתיישבות, מכיוון שהממשלה הזו היא הדבר הרע ביותר שקרה למדינה, וההתיישבות היא חלק מהמדינה, ומה שרע למדינה רע להתיישבות, ומה שטוב למדינה טוב להתיישבות. ומה שטוב להתיישבות, גברתי היושבת-ראש, זה שהממשלה הזו תסתלק מכאן כמה שיותר מהר ותתחלף בממשלה יהודית, ציונית ולאומית טובה לישראל, שתהיה בעזרת השם טובה גם להתיישבות. ויבוא יום, זאב, ואתה תצטרך להישיר מבט לילדיך, ובעזרת השם לנכדיך, ולהסביר להם מה קרה שאיבדת את הדרך והלכת לאיבוד כל כך רחוק.",הודעת הממשלה על צירוף שר לממשלה ועל שינוי בחלוקת התפקידים בין השרים,
,,ג'ידא רינאוי זועבי,,"היו""ר","תודה רבה, חבר הכנסת בצלאל סמוטריץ'. בבקשה, חבר הכנסת יואב קיש. בבקשה.",הודעת הממשלה על צירוף שר לממשלה ועל שינוי בחלוקת התפקידים בין השרים,
,,יואב קיש,הליכוד,,"כבוד היושבת-ראש, כנסת נכבדה, אני הולך להצביע נגד המינוי של סגן השר מתן כהנא, מסיבה אחת פשוטה: האבסורד. רוצים למנות לתפקיד שר דתות את האדם שנלחם הכי הרבה קשה בדת, שלקח ומייצר פה מהלך מכוון של הממשלה הזו נגד הזהות היהודית של המדינה. זה מתחיל בהכנסת חמץ לבתי הכנסת בפסח, עם רצון להפסיק – – –",הודעת הממשלה על צירוף שר לממשלה ועל שינוי בחלוקת התפקידים בין השרים,
,,אמיר אוחנה,הליכוד,,לבתי החולים.,הודעת הממשלה על צירוף שר לממשלה ועל שינוי בחלוקת התפקידים בין השרים,
,,יואב קיש,הליכוד,,"לבתי החולים. ""בתי כנסת"" אמרתי. אתה רואה, זה רק מראה לך – – –",הודעת הממשלה על צירוף שר לממשלה ועל שינוי בחלוקת התפקידים בין השרים,
,,אמיר אוחנה,הליכוד,,גם לשם זה יגיע.,הודעת הממשלה על צירוף שר לממשלה ועל שינוי בחלוקת התפקידים בין השרים,
,,קריאות,,,– – –,הודעת הממשלה על צירוף שר לממשלה ועל שינוי בחלוקת התפקידים בין השרים,
,,משה אבוטבול,"ש""ס",,– – – הבא.,הודעת הממשלה על צירוף שר לממשלה ועל שינוי בחלוקת התפקידים בין השרים,
,,חיים כץ,הליכוד,,כי הוא אמר שצריך לחזק את הכנסת. היום הכנסת הראתה שהיא חזקה.,הודעת הממשלה על צירוף שר לממשלה ועל שינוי בחלוקת התפקידים בין השרים,
,,יואב קיש,הליכוד,,"בתי החולים, זה אחד. יש שם שר, הורוביץ, שהחליט שהוא רוצה לדחוף את זה בכוח. גם בצבא רוצים לפגוע בכשרות. עכשיו, תבינו – ואני אומר פה למתן כהנא: לאן אתה רוצה לקחת את מדינת ישראל? כל מי שהזהות היהודית חשובה לו, בצד הזה של האולם, צריך להצביע נגד המינוי המזעזע הזה של מתן כהנא, שלקח את הכשרות והגיור, ובכל דבר הוא מנסה לפגוע ולהזיק ליהדות.אני לא אדם דתי ולא חרדי, אבל אני רואה איך הממשלה הזו עושה הכול לפגוע בחרדים והכול לפגוע בזהות היהודית. מהשקיות בסופר, שהם רוצים לייקר אותן – באמת, כל דבר פשוט בשביל לפגוע בחרדים. ומתן כהנא הוא הדמות המרכזית שמסמלת את אותו מהלך רע וקשה מול הזהות היהודית. לכן, אין שום סיבה שבעולם שאחד שהזהות היהודית חשובה לו יתמוך במהלך הזה.חשבתי שמתן כהנא הגיע לפני שבועיים לכנסת לחזק את הכנסת ואמר ליום טוב כלפון מהמפלגה שלו: הכול בסדר, חשוב שנחזק את המערכה. והינה אנחנו רואים: הכול זה סיפורי סבתא, סידור עבודה ליום טוב כלפון מחוץ לכנסת. זה היה המהלך המרכזי. גם התבזיתם, גם לא עזר לכם, גם אתם נופלים. ואני אומר עוד פעם לכל מי שהזהות היהודית חשובה לו, פה, בצד הזה: תתנגדו למינוי הזה. האיש מסמן ההפך ממה שצריך לעשות; האיש מסמן בדיוק את הדברים הרעים בממשלה שלכם, ואנחנו נעשה הכול בשביל שהמינוי הרע הזה לא יעבור. תודה.",הודעת הממשלה על צירוף שר לממשלה ועל שינוי בחלוקת התפקידים בין השרים,
,,יואב גלנט,הליכוד,,"יש לך עוד עשר שניות, יואב.",הודעת הממשלה על צירוף שר לממשלה ועל שינוי בחלוקת התפקידים בין השרים,
,,ג'ידא רינאוי זועבי,,"היו""ר","תודה רבה. חבר הכנסת יעקב מרגי – אינו נוכח. ואחרון הדוברים, חבר הכנסת דוד ביטן, בבקשה.",הודעת הממשלה על צירוף שר לממשלה ועל שינוי בחלוקת התפקידים בין השרים,
,,חיים כץ,הליכוד,,"דוד, קרע אותם, תראה להם מה זה. 24:00, תן להם בראש.",הודעת הממשלה על צירוף שר לממשלה ועל שינוי בחלוקת התפקידים בין השרים,
,,יואב גלנט,הליכוד,,"ביטן, תסביר למה לא להביא בחירות עכשיו – – –",הודעת הממשלה על צירוף שר לממשלה ועל שינוי בחלוקת התפקידים בין השרים,
,,ג'ידא רינאוי זועבי,,"היו""ר",בבקשה.,הודעת הממשלה על צירוף שר לממשלה ועל שינוי בחלוקת התפקידים בין השרים,
,,דוד ביטן,הליכוד,,"חבר'ה, ב-24:00 – – –",הודעת הממשלה על צירוף שר לממשלה ועל שינוי בחלוקת התפקידים בין השרים,
,,ג'ידא רינאוי זועבי,,"היו""ר",24:34.,הודעת הממשלה על צירוף שר לממשלה ועל שינוי בחלוקת התפקידים בין השרים,
,,חיים כץ,הליכוד,,"אנחנו ישנו צוהריים, הכול טוב.",הודעת הממשלה על צירוף שר לממשלה ועל שינוי בחלוקת התפקידים בין השרים,
,,דוד ביטן,הליכוד,,"טוב, אתה בן 80 עוד מעט, מה אתה רוצה, לא תישן צוהריים?",הודעת הממשלה על צירוף שר לממשלה ועל שינוי בחלוקת התפקידים בין השרים,
,,משה אבוטבול,"ש""ס",,גם בנט ישן צוהריים ועד היום הוא ישן.,הודעת הממשלה על צירוף שר לממשלה ועל שינוי בחלוקת התפקידים בין השרים,
,,דוד ביטן,הליכוד,,"אבל תראה את אבוטבול, ערני בצורה בלתי רגילה. אה, אבוטבול? אפשר להתחיל?",הודעת הממשלה על צירוף שר לממשלה ועל שינוי בחלוקת התפקידים בין השרים,
,,חיים כץ,הליכוד,,תן להם בדיחה אחת קטנה.,הודעת הממשלה על צירוף שר לממשלה ועל שינוי בחלוקת התפקידים בין השרים,
,,דוד ביטן,הליכוד,,"אתם רוצים בדיחה, אבל ייקחו לי את הזמן. טוב, כבוד היושב-ראש, כנסת נכבדה.",הודעת הממשלה על צירוף שר לממשלה ועל שינוי בחלוקת התפקידים בין השרים,
,,חיים כץ,הליכוד,,כבוד היושבת-ראש.,הודעת הממשלה על צירוף שר לממשלה ועל שינוי בחלוקת התפקידים בין השרים,
,,דוד ביטן,הליכוד,,"היושבת-ראש, מסכים. אני רוצה להגיד לכם, אתם כולם מדברים על איזה שר דתות הוא היה.",הודעת הממשלה על צירוף שר לממשלה ועל שינוי בחלוקת התפקידים בין השרים,
,,חוה אתי עטייה,הליכוד,,לא שומעים.,הודעת הממשלה על צירוף שר לממשלה ועל שינוי בחלוקת התפקידים בין השרים,
,,דוד ביטן,הליכוד,,"אתם כולכם מדברים על איזה שר הוא היה. אין ויכוח ששר דתות שהולך נגד הדת זה דבר שהוא חסר תקדים. כל שר דתות שהיה, קודם כול הוא תומך בדת. גם שר החינוך תומך בחינוך, כל שר צריך לעשות את העבודה, אבל שר שהולך בעצם נגד מה שהוא מייצג, אז אנחנו בבעיה. ובעיקר אתם לא יודעים איזה צרות הוא עשה במועצות הדתיות לראשי ערים. הוא עשה את כל התרגילים על מנת להכניס אנשים של ימינה, רק שאין מספיק אנשים בימינה, אז אני לא יודע את מי הוא הכניס בסוף. אבל מה? מה שהפריע לי הכי הרבה אצלו זה הנושא, מה שעשו לכלפון. זה דבר שאני לא ראיתי.",הודעת הממשלה על צירוף שר לממשלה ועל שינוי בחלוקת התפקידים בין השרים,
,,חיים כץ,הליכוד,,ג'וב טוב.,הודעת הממשלה על צירוף שר לממשלה ועל שינוי בחלוקת התפקידים בין השרים,
,,דוד ביטן,הליכוד,,"אנחנו קראנו לו ג'וב טוב, אבל מה שעשו לו – לי כאב הלב. על מה הוציאו אותו? באמת, על מה? ולעשות לו תרגיל כזה שמעיפים אותו מהרגע להרגע וששר הדתות משתתף בעניין הזה, מתפטר על מנת לחזור ועכשיו הוא עומד בפנינו ורוצה לחזור לתפקיד שלו – רק על התרגיל הזה, שאני קורא לו תרגיל מסריח, רק על התרגיל הזה לא מגיע לו לחזור להיות שר הדתות. מגיע לו להישאר סגן שר הדתות. לא שאני נגד סגנים, באמת שלא; הינה, אתה סגן, עושה עבודה טובה גם כסגן, אבל לא עושים דבר כזה לאנשים, מהרגע להרגע אומרים לו: אתה לא חבר כנסת על פי החוק הנורבגי. על מה? מה, הוא ינהל איתנו משא ומתן? דווקא הופעתי מולו כמה פעמים בתקשורת ובסופו של דבר הוא היה בסדר גמור, תמך בקואליציה, ואני עד היום לא מבין למה עשו את זה. הוא צריך לתת לנו הסבר למה בנט והוא עשו את הדבר הזה, מה הם רצו להוכיח. אמרו: לא, רוצים לאיים על סילמן או על מישהו אחר שיפרוש מימינה. ואני אומר לכם: לא עושים דבר כזה. על הרקע הזה קודם כול אנחנו צריכים להצביע נגדו.דבר שני, אני מסכים עם גפני שאדם – למרות שהוא ימשיך לעשות את זה כסגן שר הדתות, זה לא יעזור לכם; גם פה הוא יעשה לכם בלגן, כי הוא יקבל תמיכה מראש הממשלה, שהוא בעצם שר הדתות, אז זה לא יעזור לכם הרבה, אבל אתם צודקים לגבי הטיעונים. אז החטא ועונשו: עשה צרות לכלפון ללא סיבה – לא מגיע לו לחזור לתפקיד. תודה רבה.",הודעת הממשלה על צירוף שר לממשלה ועל שינוי בחלוקת התפקידים בין השרים,
,,איתן גינזבורג,,"היו""ר","תודה רבה לחבר הכנסת דוד ביטן. חברים, תם הדיון בהודעת הממשלה. יסכם – – –",הודעת הממשלה על צירוף שר לממשלה ועל שינוי בחלוקת התפקידים בין השרים,
,,משה גפני,יהדות התורה,,אפשר להצביע?,הודעת הממשלה על צירוף שר לממשלה ועל שינוי בחלוקת התפקידים בין השרים,
