knesset,session,speaker,party,role,text,subject,sub_subject
,,צבי האוזר,,"היו""ר",תודה רבה.,"הצעת חוק להארכת תוקפן של תקנות שעת חירום (יהודה והשומרון – שיפוט בעבירות ועזרה משפטית), התשפ""ב–2022",(קריאה ראשונה)
,,עאידה תומא סלימאן,הרשימה המשותפת,,אני אומרת לכם – אל תטרחו. הרי אתם מיישמים את דרכם טוב מאוד.,"הצעת חוק להארכת תוקפן של תקנות שעת חירום (יהודה והשומרון – שיפוט בעבירות ועזרה משפטית), התשפ""ב–2022",(קריאה ראשונה)
,,צבי האוזר,,"היו""ר","תודה רבה. חבר הכנסת אוריאל בוסו. סליחה, סליחה, אני מתנצל, חבר הכנסת יואב בן צור. לפי הרשימה שלי, חבר הכנסת בן צור.","הצעת חוק להארכת תוקפן של תקנות שעת חירום (יהודה והשומרון – שיפוט בעבירות ועזרה משפטית), התשפ""ב–2022",(קריאה ראשונה)
,,משה אבוטבול,"ש""ס",,אין מוקדם ומאוחר בתורה. אוהבים את כולם.,"הצעת חוק להארכת תוקפן של תקנות שעת חירום (יהודה והשומרון – שיפוט בעבירות ועזרה משפטית), התשפ""ב–2022",(קריאה ראשונה)
,,צבי האוזר,,"היו""ר","אמת. בבקשה, חבר הכנסת בן צור, אני מתנצל. שלוש דקות.","הצעת חוק להארכת תוקפן של תקנות שעת חירום (יהודה והשומרון – שיפוט בעבירות ועזרה משפטית), התשפ""ב–2022",(קריאה ראשונה)
,,יואב בן צור,"ש""ס",,"הכול נשאר במשפחה, הכול בסדר. אדוני היושב-ראש, גברתי השרה, כנסת נכבדה, בימים אלה קשה מאוד לחיות כאן. קשה לגדל ילדים ולפרנס משפחה בכבוד. יוקר המחיה ממשיך לטפס, ואין אזרח שלא נרמס תחת הרכבת הדורסנית הזאת של הממשלה. אין מילים בפי לבטא רעב של ילד; אין מילים לבטא את הכאב של אימא שמחזירה מוצרים בסיסיים בסופר בגלל מחסור בכסף.יושבים כאן חברי כנסת שמכירים את ימי הצנע, שיודעים מה זה לגדול בחיי מחסור; חברי כנסת שזוכרים את הוריהם, אשר בקום המדינה עבדו בעבודות כפיים כדי שנוכל לחיות פה. אני זועק את זעקת השקופים אשר קולם אינו נשמע. למה הכיסא גורם לכם להתאכזר לילדים קטנים חסרי ישע ולתת להם לגווע ברעב? למה ג'וב פוליטי, שחולף מן העולם, גורם לכם לשכוח את העבר ולהרוס את עתיד ילדינו?לפי נתונים שהתפרסמו, תחולת העוני למשפחות בישראל בשנה החולפת 2021 עלתה ב-1.1% ל-21.5%; תחולת העוני של ילדים עלתה ב-2.5% ל-31.2%; כלומר כמעט כל ילד שלישי הוא עני. אתם שומעים? כל ילד שלישי במדינת ישראל הוא עני. כך עולה מאומדנים שפורסמו באתר הביטוח הלאומי במסגרת דוח העוני. לפי הנתונים, האי-שוויון נמדד על ידי מדד ג'יני, שעלה בשנה שחלפה ב-3.3% לעומת 2020; על פי דוח העוני של לתת, כמעט מיליון משקי בית בישראל נמצאים במצוקה כלכלית. בדוח שפורסם על מדד העוני בשנת 2020, למרות משבר הקורונה והמוני המובטלים דווקא הייתה ירידה בשיעור העוני. הדבר נבע מסיבה – אדוני היושב-ראש, קשה לדבר ככה.","הצעת חוק להארכת תוקפן של תקנות שעת חירום (יהודה והשומרון – שיפוט בעבירות ועזרה משפטית), התשפ""ב–2022",(קריאה ראשונה)
,,צבי האוזר,,"היו""ר",אני מבקש שקט בתאים.,"הצעת חוק להארכת תוקפן של תקנות שעת חירום (יהודה והשומרון – שיפוט בעבירות ועזרה משפטית), התשפ""ב–2022",(קריאה ראשונה)
,,יואב בן צור,"ש""ס",,"הדבר נבע מסיבה עיקרית אחת: הסיוע הגדול שחילקה ממשלת נתניהו, באמצעות דמי אבטלה ומענקים לכל אזרח. בביטוח הלאומי מסבירים את העלייה המשמעותית במדדי העוני בהפחתת הסיוע הממשלתי הרחב שניתן ב-2020 בדמות דמי אבטלה ומענקים לכל האזרחים.אני מצטט את דבריו של המנכ""ל המוכשר והרגיש של הביטוח הלאומי דאז, מר מאיר שפיגלר: בעידן הקורונה הייתה לדמי אבטלה משמעות קריטית ליכולת של אזרחי ישראל לתפקד כלכלית ולצלוח את התקופה הקשה בצורה הטובה ביותר. האוכלוסייה שנפגעה ביותר במשבר היא העצמאים ובעלי העסקים. יש לתת גם להם ביטחון סוציאלי בדמות דמי אבטלה.","הצעת חוק להארכת תוקפן של תקנות שעת חירום (יהודה והשומרון – שיפוט בעבירות ועזרה משפטית), התשפ""ב–2022",(קריאה ראשונה)
,,צבי האוזר,,"היו""ר",תודה רבה.,"הצעת חוק להארכת תוקפן של תקנות שעת חירום (יהודה והשומרון – שיפוט בעבירות ועזרה משפטית), התשפ""ב–2022",(קריאה ראשונה)
,,יואב בן צור,"ש""ס",,אני מייד מסיים. עוד כמה מילים.,"הצעת חוק להארכת תוקפן של תקנות שעת חירום (יהודה והשומרון – שיפוט בעבירות ועזרה משפטית), התשפ""ב–2022",(קריאה ראשונה)
,,צבי האוזר,,"היו""ר","לא, משפט סיכום, בבקשה.","הצעת חוק להארכת תוקפן של תקנות שעת חירום (יהודה והשומרון – שיפוט בעבירות ועזרה משפטית), התשפ""ב–2022",(קריאה ראשונה)
,,יואב בן צור,"ש""ס",,"הוא קרא להעלות את קצבת הבטחת ההכנסה, שמיועדת למשפחות העניות. אזרחי ישראל מרוב השעבוד לסגור את החודש ולשרוד את חיי היום-יום אין לנו רגע לעצור את מרוץ החיים הבלתי-פוסק ולחשוב לרגע על מצבנו העגום.","הצעת חוק להארכת תוקפן של תקנות שעת חירום (יהודה והשומרון – שיפוט בעבירות ועזרה משפטית), התשפ""ב–2022",(קריאה ראשונה)
,,צבי האוזר,,"היו""ר",תודה רבה.,"הצעת חוק להארכת תוקפן של תקנות שעת חירום (יהודה והשומרון – שיפוט בעבירות ועזרה משפטית), התשפ""ב–2022",(קריאה ראשונה)
,,יואב בן צור,"ש""ס",,"לא נולדנו כדי לשרת את התענוגות והשיגעונות של פוליטיקאים. אני מבקש – הממשלה, לצערנו, שבעה; העם רעב. ובנט עסוק בכתיבת איגרת, שברגעים אלה עוטפים איתה את הדגים. תודה רבה.","הצעת חוק להארכת תוקפן של תקנות שעת חירום (יהודה והשומרון – שיפוט בעבירות ועזרה משפטית), התשפ""ב–2022",(קריאה ראשונה)
,,צבי האוזר,,"היו""ר","תודה רבה. חבר הכנסת אוריאל בוסו, בבקשה, שלוש דקות.","הצעת חוק להארכת תוקפן של תקנות שעת חירום (יהודה והשומרון – שיפוט בעבירות ועזרה משפטית), התשפ""ב–2022",(קריאה ראשונה)
,,אוריאל בוסו,"ש""ס",,"אדוני היושב-ראש, חבריי חברי הכנסת, מדברים על תקנות ביהודה ושומרון, זכויות, לא זכויות, אבל אני רוצה לדבר על משהו אחר. מי שהיה בערב חג השבועות במרכולים, בסופרים, ראה את האזרחים משתדלים לשים קצת מצרכים בעגלות, הבין שמדינת ישראל נמצאת באירוע חסר תקדים. שר האוצר, שכשאני מסתכל על רשימת הנגידים והחברים האוליגרכים שלו, אני מבין את המשמעות שהשבע לעולם לא יכול להבין את הרעב.התופעה שקרתה לי בערב החג, אני מסתובב בסופר ואנשים מבינים, מכירים אותי – רואים בן אדם עם עניבה ואומרים לי: אתה יכול אולי קצת לעזור לי בכמה שקלים? לא מגיעים לקופה. לפני כן הם מסתובבים ומנסים את מזלם באנשים. מעולם לא היה כזה דבר. ראש הממשלה, המלך לואי ה-15, כותב איגרת לרוב הדומם. העם מדמם – זה הרוב במדינת ישראל. אליו אתה לא כותב איגרת. מבחינתך כל יום שעובר ועוד חלק מ-50 מיליון בשיפוץ של הבית שלך מתבזבז, זה בסדר. מבחינתך שהמדינה תישרף בעוד חודש-חודשיים – את האקזיט שלך על המדינה כבר עשית. אף אחד לא ייקח ממך את הכסף בחזרה. מה עם העם שנמצא בפריפריה, במרכז, שלא יכול לא לגמור את החודש, לא יכול להתחיל את החודש? כבר לא מדובר בפינוקים, לא מדובר בטיסות לחו""ל, מדובר באוכל, בשמן, בסוכר, בלחם. זה מעניין מישהו? פותחים את המכסים, מורידים כל מיני רגולציות. בשורה התחתונה – ניסו ללעוג לציבור: כן חד-פעמי, לא חד-פעמי, לציבור החרדי. זה טפח לממשלה על הפרצוף.היום אנחנו רואים את יוקר המחיה שמידרדר, שפל חסר תקדים. נוח להם שידברו על תקנות יהודה ושומרון וידברו על כל מיני משברים בקואליציה–אופוזיציה כדי לא לדבר על הדבר האמיתי. זאת הבעיה שלנו במדינת ישראל, ואת זה אתם משתיקים. והתקשורת, שמתעסקת באותן שטויות ומשחקת במשחק של הממשלה, היא צריכה להסתכל לעצמה במראה ולהגיד: האם התפקיד שאנחנו מחויבים לעשות כתקשורת – לחשוף את היוקר ואת כל הסיאוב האמיתי שיש באוצר, לאן מקצים את הכספים, מי הסוחט היומי על כל חוק וחוק – –","הצעת חוק להארכת תוקפן של תקנות שעת חירום (יהודה והשומרון – שיפוט בעבירות ועזרה משפטית), התשפ""ב–2022",(קריאה ראשונה)
,,צבי האוזר,,"היו""ר",לסיכום.,"הצעת חוק להארכת תוקפן של תקנות שעת חירום (יהודה והשומרון – שיפוט בעבירות ועזרה משפטית), התשפ""ב–2022",(קריאה ראשונה)
,,אוריאל בוסו,"ש""ס",,"– – שיקבל עוד מאות מיליונים. גם בערב הזה בטח ניחשף לעוד הצבעה שבה יקבלו עוד 200, עוד 400 מיליון. אבל את אזרחי ישראל זה לא מעניין. הרוב המדמם במדינת ישראל מחכה לאיגרת האמיתית שלו. תודה רבה.","הצעת חוק להארכת תוקפן של תקנות שעת חירום (יהודה והשומרון – שיפוט בעבירות ועזרה משפטית), התשפ""ב–2022",(קריאה ראשונה)
,,צבי האוזר,,"היו""ר",תודה רבה. חבר הכנסת איימן עודה.,"הצעת חוק להארכת תוקפן של תקנות שעת חירום (יהודה והשומרון – שיפוט בעבירות ועזרה משפטית), התשפ""ב–2022",(קריאה ראשונה)
,,איימן עודה,הרשימה המשותפת,,"כבוד היושב-ראש, עמיתיי חברי הכנסת וחברות הכנסת – הפלאחים, האיכרים, הפלסטינים משתמשים בפתגם שאומר: (אומר בערבית ומתרגם:) תן בלע מגל. תן בלע מגל. הוא לא יודע מה לעשות עם המגל הזה, שפוגע בו בפנים, בתוך הגוף שלו. זה בדיוק מה שקרה עם מדינת ישראל אחרי שכבשה את העם הפלסטיני בשנת 67'. תן בלע מגל. וזה מה שאנחנו רואים אחרי 55 שנים לכיבוש של שנת 67'. אני אומר לכם שהסוגיה הפלסטינית היא זו שבעיקר מונעת יציבות בתוך מדינת ישראל, אם זה בדמוקרטיה, אם זה בחוסר הצדק החברתי, אם זה הפגיעה הישירה, כמו שאנחנו רואים עכשיו, גם ביום הזה.תמיד חשבתי לעצמי שבפני מדינת ישראל יש שתי אופציות, אפשרויות. אחת היא להיות מדינה קולוניאליסטית, ואחרת – להיות מדינה טבעית. מדינה טבעית, כלומר, מדינה שמקדמת שלום, בעיקר עם העם הפלסטיני, אחר כך עם השכנים – עם האזרחים הערבים הפלסטינים. להכיר בנכבה, בעוול ההיסטורי. שתהיה מדינה דמוקרטית לכולם, ולא מדינה שמקדמת עליונות לעם על חשבון עם אחר. יש את האופק הזה, להיות מדינה טבעית, עם שלום, לא כובשת, לא מפלה לרעה, ויש את האפשרות השנייה: להיות מדינה קולוניאליסטית.בכל פעם קברניטי המדינה מחליטים שהמדינה תהיה קולוניאליסטית. חוק הלאום, למשל, אומר שיש עם יותר חשוב מעם אחר. מה, זו מדינה טבעית? מדינה שכובשת עם אחר לתקופה של 55 שנים, יותר מהתקופה שהייתה בה לפני כיבוש העם האחר בשנת 67'. במובן ההיסטורי גם שנת 48' היא כיבוש. כן, כן, כן. אבל בפשרה ההיסטורית, שאנחנו מקבלים אותה, מקבלים הקמת מדינה לצד מדינה, ושיהיה שלום. זהו לא הצדק כולו, אבל יש בו את המרכיבים העיקריים – שני העמים יכולים לחיות פה.","הצעת חוק להארכת תוקפן של תקנות שעת חירום (יהודה והשומרון – שיפוט בעבירות ועזרה משפטית), התשפ""ב–2022",(קריאה ראשונה)
,,צבי האוזר,,"היו""ר",תודה רבה.,"הצעת חוק להארכת תוקפן של תקנות שעת חירום (יהודה והשומרון – שיפוט בעבירות ועזרה משפטית), התשפ""ב–2022",(קריאה ראשונה)
,,איימן עודה,הרשימה המשותפת,,אני מסכם ואומר לך שתקנות שעת חירום משנת 48' עד עכשיו זה כיוון קולוניאליסטי ולא טבעי. תודה.,"הצעת חוק להארכת תוקפן של תקנות שעת חירום (יהודה והשומרון – שיפוט בעבירות ועזרה משפטית), התשפ""ב–2022",(קריאה ראשונה)
,,צבי האוזר,,"היו""ר",תודה רבה. חבר הכנסת אופיר אקוניס. שלוש דקות לרשותך.,"הצעת חוק להארכת תוקפן של תקנות שעת חירום (יהודה והשומרון – שיפוט בעבירות ועזרה משפטית), התשפ""ב–2022",(קריאה ראשונה)
,,אופיר אקוניס,הליכוד,,"אדוני היושב-ראש, חברות וחברי הכנסת, נפתלי בנט, ראיתם את איגרת ההסתה שלו? נפתלי בנט, הרוב הציוני הדומם אומר לך: לך. אתה מגוחך, אתה ילדותי, אתה איבדת קשר עם המציאות, אתה אדם מסוכן.אבל היום, אדוני היושב-ראש, אני מבקש להתייחס דווקא לצד אחר של המפה הפוליטית, אם כי נפתלי בנט עושה בצעדי ענק את דרכו אל הצד השמאלי של המפה הפוליטית. היום אני מבקש להתייחס לשמאל הפשיסטי, לשמאל המשיחי, לשמאל המסית, הידוע בהסתתו ארוכת השנים נגד הימין הלאומי ונגד הלאומיות הציונית. קודם, אדוני היושב-ראש, המציאו את העם הפלסטיני. המציאו. השמאל הישראלי המציא את העם הפלסטיני. מתי הם המציאו אותו? אחרי ניצחוננו הענק, השבוע לפני 55 שנה, במלחמת ששת הימים. חזרנו לשומרון, חזרנו ליהודה, לרמת הגולן – והם המציאו עם. השמאל הפשיסטי המציא עם, העם הפלסטיני המומצא. אחר כך, אדוני היושב-ראש, המציאו את רעיון שתי המדינות. עוד המצאה של השמאל הפשיסטי. אחר כך, בייאושו, השמאל המסית, המכליל, מעליל העלילות, החל להפיץ את ההשוואה המטורללת לאפרטהייד. אחר כך הקימו ארגון – במימון אירופי, אדוני היושב-ראש. כן, ברור, במימון אירופי – שמלשין על כוחותינו בפעילות מבצעית. והיום – היום 5 ביוני, כן? – 5 ביוני – – –","הצעת חוק להארכת תוקפן של תקנות שעת חירום (יהודה והשומרון – שיפוט בעבירות ועזרה משפטית), התשפ""ב–2022",(קריאה ראשונה)
,,צבי האוזר,,"היו""ר",היום 6.,"הצעת חוק להארכת תוקפן של תקנות שעת חירום (יהודה והשומרון – שיפוט בעבירות ועזרה משפטית), התשפ""ב–2022",(קריאה ראשונה)
,,אופיר אקוניס,הליכוד,,"6 ביוני 2022, אחרי 55 שנה של הסתה – הרי לא חבר הכנסת טיבי המציא את העם הפלסטיני ולא חבר הכנסת איימן עודה המציא את העם הפלסטיני; השמאל הישראלי הציוני היהודי המציא את העם הפלסטיני. עכשיו – – –","הצעת חוק להארכת תוקפן של תקנות שעת חירום (יהודה והשומרון – שיפוט בעבירות ועזרה משפטית), התשפ""ב–2022",(קריאה ראשונה)
,,איימן עודה,הרשימה המשותפת,,אז הוא המציא שני עמים – – –,"הצעת חוק להארכת תוקפן של תקנות שעת חירום (יהודה והשומרון – שיפוט בעבירות ועזרה משפטית), התשפ""ב–2022",(קריאה ראשונה)
,,אופיר אקוניס,הליכוד,,"אני לא מדבר עליך, אני לא מדבר עליך. תהיה המום, אני לא מדבר עליך. הטענה שלי היא – – –","הצעת חוק להארכת תוקפן של תקנות שעת חירום (יהודה והשומרון – שיפוט בעבירות ועזרה משפטית), התשפ""ב–2022",(קריאה ראשונה)
,,איימן עודה,הרשימה המשותפת,,"אבל תגיד לי משהו, תענה על השאלה. מי המציא את העם הירדני?","הצעת חוק להארכת תוקפן של תקנות שעת חירום (יהודה והשומרון – שיפוט בעבירות ועזרה משפטית), התשפ""ב–2022",(קריאה ראשונה)
,,אופיר אקוניס,הליכוד,,"בבקשה, רק תוסיף לי זמן. מי המציא את העם הירדני?","הצעת חוק להארכת תוקפן של תקנות שעת חירום (יהודה והשומרון – שיפוט בעבירות ועזרה משפטית), התשפ""ב–2022",(קריאה ראשונה)
,,איימן עודה,הרשימה המשותפת,,"המצרים, המצרים – – –","הצעת חוק להארכת תוקפן של תקנות שעת חירום (יהודה והשומרון – שיפוט בעבירות ועזרה משפטית), התשפ""ב–2022",(קריאה ראשונה)
,,אופיר אקוניס,הליכוד,,לא לא לא. את העם הירדני – – –,"הצעת חוק להארכת תוקפן של תקנות שעת חירום (יהודה והשומרון – שיפוט בעבירות ועזרה משפטית), התשפ""ב–2022",(קריאה ראשונה)
,,איימן עודה,הרשימה המשותפת,,רק הפלסטינים צריכים את השמאל הישראלי שימציא אותם.,"הצעת חוק להארכת תוקפן של תקנות שעת חירום (יהודה והשומרון – שיפוט בעבירות ועזרה משפטית), התשפ""ב–2022",(קריאה ראשונה)
,,אופיר אקוניס,הליכוד,,"את העם הירדני המציאה ידידתנו בריטניה הגדולה בשנת 1922, ומשרד החוץ – – –","הצעת חוק להארכת תוקפן של תקנות שעת חירום (יהודה והשומרון – שיפוט בעבירות ועזרה משפטית), התשפ""ב–2022",(קריאה ראשונה)
,,איימן עודה,הרשימה המשותפת,,"אה, אז רק אתם עם, רק אתם עם.","הצעת חוק להארכת תוקפן של תקנות שעת חירום (יהודה והשומרון – שיפוט בעבירות ועזרה משפטית), התשפ""ב–2022",(קריאה ראשונה)
,,אופיר אקוניס,הליכוד,,"כן, לא היה עם ירדני. מה לעשות, איימן עודה, חבר הכנסת עודה? עד 1922 לא היה עם ירדני.","הצעת חוק להארכת תוקפן של תקנות שעת חירום (יהודה והשומרון – שיפוט בעבירות ועזרה משפטית), התשפ""ב–2022",(קריאה ראשונה)
,,איימן עודה,הרשימה המשותפת,,איך אתם בונים לעצמכם דמיון.,"הצעת חוק להארכת תוקפן של תקנות שעת חירום (יהודה והשומרון – שיפוט בעבירות ועזרה משפטית), התשפ""ב–2022",(קריאה ראשונה)
,,אופיר אקוניס,הליכוד,,"מה לעשות, אדוני היושב-ראש, מה אני יכול לעשות שמשרד המושבות הבריטי המציא את ממלכת ירדן?","הצעת חוק להארכת תוקפן של תקנות שעת חירום (יהודה והשומרון – שיפוט בעבירות ועזרה משפטית), התשפ""ב–2022",(קריאה ראשונה)
,,צבי האוזר,,"היו""ר","אני לא יודע מה, אבל יש לך 20 שניות לעשות.","הצעת חוק להארכת תוקפן של תקנות שעת חירום (יהודה והשומרון – שיפוט בעבירות ועזרה משפטית), התשפ""ב–2022",(קריאה ראשונה)
,,אופיר אקוניס,הליכוד,,אבל הוא הפריע לי.,"הצעת חוק להארכת תוקפן של תקנות שעת חירום (יהודה והשומרון – שיפוט בעבירות ועזרה משפטית), התשפ""ב–2022",(קריאה ראשונה)
,,צבי האוזר,,"היו""ר",אז נתתי לך עוד 20 שניות.,"הצעת חוק להארכת תוקפן של תקנות שעת חירום (יהודה והשומרון – שיפוט בעבירות ועזרה משפטית), התשפ""ב–2022",(קריאה ראשונה)
,,אופיר אקוניס,הליכוד,,"אז בזה אני אסיים. עכשיו, אחרי שענינו לחבר הכנסת עודה מי המציא את העם הפלסטיני – השמאל הישראלי, ומי המציא את העם הירדני – משרד המושבות הבריטי לפני 100 שנה, הערב, היום הזה, הצבועים, הנסחטים, המושחתים, ש-55 שנה הוציאו את דיבתה של ישראל בעולם כולו, יצביעו הערב בעד תקנות יהודה ושומרון. והערב – ובזה אני מסיים – כדי לשרוד, כדי לגנוב עוד שבוע, כדי למנות עוד מקורבים לתפקידים, כדי להעלות עוד מיסים על אזרחי ישראל, הם יצביעו בעד תקנות יו""ש. שולמית אלוני ויוסי שריד מסתכלים על השמאל הישראלי כעת, וכמו כל עם ישראל, בזים להם.","הצעת חוק להארכת תוקפן של תקנות שעת חירום (יהודה והשומרון – שיפוט בעבירות ועזרה משפטית), התשפ""ב–2022",(קריאה ראשונה)
,,צבי האוזר,,"היו""ר",תודה רבה. חבר הכנסת משה טור פז. שלוש דקות.,"הצעת חוק להארכת תוקפן של תקנות שעת חירום (יהודה והשומרון – שיפוט בעבירות ועזרה משפטית), התשפ""ב–2022",(קריאה ראשונה)
